"Trends","Search volume","Started","Ended","Trend breakdown","Explore link"
"india vs england","5M+","20 June 2025 at 04:50:00 UTC+5:30",,"india vs england,ind vs eng,kl rahul,yashasvi jaiswal,brydon carse,ind vs eng live,live score,test match,india national cricket team,india vs england live,live cricket,live cricket score,ind vs,india vs eng,ind v eng,jaiswal,india cricket,test match ind vs eng,india england,ind vs eng live score,today test match,live cricket match today,ind eng test,where to watch india national cricket team vs england cricket team,test match live,icc cricket live today,india national cricket team vs england cricket team timeline,in vs eng,cricket live,cricket india,live cricket score cricbuzz,cricket,india versus england test match,test match score,india england test match live,test score,england vs india today match,india-england,india vs england live score,india-england test,ind vs eng 2025,yashasvi jaiswal stats,headingley,test cricket score,today test match score,india versus england test,live cricket match,india versus england test series,ind vs eng highlights,india-england match,ind vs eng test live,test match today,live cricket match today india,ind va eng,india score,india versus england match,ind vs eng t20,test cricket live,ind vs eng score,ind vs wng,india england test series,india live score,india vs england test match,eng vs ind test 2025,ind vs eng test 1,live cricket score india,india vs england score,yashasvi jaiswal centuries,live cricket scores,live cricket score today,eng vs ind live,ind. vs eng,cricket score live,live test match,live score today,start","https://trends.google.com/trends/explore?q=india%20vs%20england&geo=IN&hl=en-GB"
"india national cricket team vs england cricket team match scorecard","1M+","20 June 2025 at 15:00:00 UTC+5:30",,"india national cricket team vs england cricket team match scorecard,england cricket team vs india national cricket team match scorecard,rishabh pant,shubman gill,england vs india,where to watch england cricket team vs india national cricket team,cricket score,england cricket team vs india national cricket team,india national cricket team vs england cricket team,india test match,gill,england,cricket live score,eng vs india,shubman gill stats,sena countries,highest score in test,shubman gill century,england cricket team,highest test score,sunil gavaskar,england cricket team vs india","https://trends.google.com/trends/explore?q=india%20national%20cricket%20team%20vs%20england%20cricket%20team%20match%20scorecard&geo=IN&hl=en-GB"
"ind vs eng test","500K+","20 June 2025 at 04:50:00 UTC+5:30",,"ind vs eng test,sai sudharsan,india versus england,eng vs ind test,ind vs england,ind eng,cricinfo,india vs england test,india england test,india match,england cricket team vs india national cricket team timeline,test,today match,test cricket,cricket test,india-england test match,test ind vs eng,india vs england live streaming channel free,leeds,cricket match,india at england,ind vs end,india test,cricket india vs england,test match live score,india vs,test cricket india vs england,ind vs en,leeds weather,imd vs eng,ind test,england versus india,ind vs eng test 2025 live streaming,ind vs eng test live streaming channel,ind vs eng live streaming,india vs england live streaming channel,ind vs eng test series,headingley carnegie,today test match india vs england,bashir,cricket test match,ind match,test live,jamie overton,where to watch ind vs eng,india england test series 2025,england vs india test series 2025,india vs england live streaming,ind vs eng toss,test live score,ind vs eng toss time,eng ind,sai sudarshan,kuldeep yadav,india vs england test series 2025 live streaming,ind vs eng where to watch,eng vs ind toss,ind vs eng live on which channel,ind vs eng live streaming channel,india vs england test series 2025 broadcast channel,india vs england toss,ind vs eng test live streaming,eng vs ind toss time,england vs india toss,england cricket team vs india national cricket,weather report today","https://trends.google.com/trends/explore?q=ind%20vs%20eng%20test&geo=IN&hl=en-GB"
"seattle sounders vs atlético madrid","50K+","20 June 2025 at 02:40:00 UTC+5:30",,"seattle sounders vs atlético madrid,pablo barrios,atletico madrid","https://trends.google.com/trends/explore?q=seattle%20sounders%20vs%20atl%C3%A9tico%20madrid&geo=IN&hl=en-GB"
"flamengo vs chelsea","10K+","20 June 2025 at 22:40:00 UTC+5:30",,"flamengo vs chelsea,luiz araújo","https://trends.google.com/trends/explore?q=flamengo%20vs%20chelsea&geo=IN&hl=en-GB"
"ind","20K+","20 June 2025 at 06:10:00 UTC+5:30",,"ind,777,flight status","https://trends.google.com/trends/explore?q=ind&geo=IN&hl=en-GB"
"मौसम","1M+","20 June 2025 at 06:40:00 UTC+5:30","20 June 2025 at 08:30:00 UTC+5:30","मौसम,आज का मौसम,मौसम की जानकारी,आज का मौसम कैसा रहेगा,वेदर,आज का मौसम कैसा है,आज के मौसम की जानकारी,कल मौसम कैसा रहेगा?,क्या आज बारिश होगी?,mausam vibhag,आज शाम का मौसम,मौसम का हाल,आज मौसम क्या है,आज बारिश होगी,मौसम कल,मौसम विभाग,weather update,आज मौसम कैसा रहेगा","https://trends.google.com/trends/explore?q=%E0%A4%AE%E0%A5%8C%E0%A4%B8%E0%A4%AE&geo=IN&hl=en-GB"